{
  "schema_version": "0.2.0",
  "template_id": "outfit-reel-001",
  "coordinate_space": "canvas-pixels",
  "canvas": {
    "width": 576,
    "height": 1024,
    "background": "#FFFFFF",
    "source_rect": {"x": 0, "y": 128, "width": 576, "height": 1024}
  },
  "source": {
    "duration_frames": 347,
    "fps": 30,
    "width": 576,
    "height": 1280,
    "source_sha256": "0000000000000000000000000000000000000000000000000000000000000000"
  },
  "support": {
    "level": "S1",
    "confidence": 0.96,
    "warnings": [
      "source_sha256 is a 64-zero placeholder and must be replaced with the measured source hash before freezing this template.",
      "Example switch frames and carousel motion must be confirmed against measured reference evidence before approval."
    ]
  },
  "tracks": [
    {"id": "background", "type": "background", "z_index": 0, "overlap_policy": "forbid"},
    {"id": "model", "type": "subject", "z_index": 10, "overlap_policy": "forbid"},
    {
      "id": "product-carousel",
      "type": "carousel",
      "z_index": 30,
      "overlap_policy": "allow",
      "group_layout": {
        "type": "carousel",
        "origin": {"x": 8, "y": 20},
        "item_slots": [
          "product.01", "product.02", "product.03", "product.04", "product.05", "product.06",
          "product.07", "product.08", "product.09", "product.10", "product.11", "product.12"
        ],
        "item_width": 72,
        "item_height": 160,
        "gap": 8,
        "direction": "horizontal",
        "repeat": "none"
      },
      "group_transform": {
        "anchor": {"x": 0, "y": 0},
        "keyframes": [
          {"frame": 0, "translate_x": 0, "translate_y": 0, "scale_x": 1, "scale_y": 1, "rotation_deg": 0, "opacity": 1, "easing": {"type": "cubic-bezier", "control_points": [0.25, 0.1, 0.25, 1]}},
          {"frame": 346, "translate_x": -384, "translate_y": 0, "scale_x": 1, "scale_y": 1, "rotation_deg": 0, "opacity": 1, "easing": {"type": "hold"}}
        ]
      },
      "clip_mask": {
        "type": "rect",
        "space": "canvas",
        "rect": {"x": 0, "y": 0, "width": 576, "height": 200},
        "feather_px": 0,
        "invert": false
      }
    }
  ],
  "slots": [
    {"id": "model.identity", "type": "identity", "required": true, "accepted_media": ["image/jpeg", "image/png", "image/webp"]},
    {"id": "outfit.01", "type": "garment", "required": true, "accepted_media": ["image/png", "image/webp"]},
    {"id": "outfit.02", "type": "garment", "required": true, "accepted_media": ["image/png", "image/webp"]},
    {"id": "outfit.03", "type": "garment", "required": true, "accepted_media": ["image/png", "image/webp"]},
    {"id": "outfit.04", "type": "garment", "required": true, "accepted_media": ["image/png", "image/webp"]},
    {"id": "outfit.05", "type": "garment", "required": true, "accepted_media": ["image/png", "image/webp"]},
    {"id": "outfit.06", "type": "garment", "required": true, "accepted_media": ["image/png", "image/webp"]},
    {"id": "outfit.07", "type": "garment", "required": true, "accepted_media": ["image/png", "image/webp"]},
    {"id": "outfit.08", "type": "garment", "required": true, "accepted_media": ["image/png", "image/webp"]},
    {"id": "outfit.09", "type": "garment", "required": true, "accepted_media": ["image/png", "image/webp"]},
    {"id": "outfit.10", "type": "garment", "required": true, "accepted_media": ["image/png", "image/webp"]},
    {"id": "outfit.11", "type": "garment", "required": true, "accepted_media": ["image/png", "image/webp"]},
    {"id": "outfit.12", "type": "garment", "required": true, "accepted_media": ["image/png", "image/webp"]},
    {"id": "product.01", "type": "product-image", "required": true, "accepted_media": ["image/jpeg", "image/png", "image/webp"]},
    {"id": "product.02", "type": "product-image", "required": true, "accepted_media": ["image/jpeg", "image/png", "image/webp"]},
    {"id": "product.03", "type": "product-image", "required": true, "accepted_media": ["image/jpeg", "image/png", "image/webp"]},
    {"id": "product.04", "type": "product-image", "required": true, "accepted_media": ["image/jpeg", "image/png", "image/webp"]},
    {"id": "product.05", "type": "product-image", "required": true, "accepted_media": ["image/jpeg", "image/png", "image/webp"]},
    {"id": "product.06", "type": "product-image", "required": true, "accepted_media": ["image/jpeg", "image/png", "image/webp"]},
    {"id": "product.07", "type": "product-image", "required": true, "accepted_media": ["image/jpeg", "image/png", "image/webp"]},
    {"id": "product.08", "type": "product-image", "required": true, "accepted_media": ["image/jpeg", "image/png", "image/webp"]},
    {"id": "product.09", "type": "product-image", "required": true, "accepted_media": ["image/jpeg", "image/png", "image/webp"]},
    {"id": "product.10", "type": "product-image", "required": true, "accepted_media": ["image/jpeg", "image/png", "image/webp"]},
    {"id": "product.11", "type": "product-image", "required": true, "accepted_media": ["image/jpeg", "image/png", "image/webp"]},
    {"id": "product.12", "type": "product-image", "required": true, "accepted_media": ["image/jpeg", "image/png", "image/webp"]},
    {"id": "background", "type": "background", "required": false, "accepted_media": ["image/jpeg", "image/png", "image/webp"]},
    {"id": "audio", "type": "audio", "required": true, "accepted_media": ["audio/wav", "audio/mpeg", "audio/mp4", "audio/x-matroska"]}
  ],
  "layers": [
    {
      "id": "background-fill",
      "track_id": "background",
      "source": {"slot_id": "background", "representation": "raw"},
      "active_ranges": [{"start_frame": 0, "end_frame": 347}],
      "layout": {"box": {"x": 0, "y": 0, "width": 576, "height": 1024}, "fit": "cover", "object_position": {"x": 0.5, "y": 0.5}},
      "transform": {"anchor": {"x": 288, "y": 512}, "keyframes": [{"frame": 0, "translate_x": 0, "translate_y": 0, "scale_x": 1, "scale_y": 1, "rotation_deg": 0, "opacity": 1, "easing": {"type": "hold"}}]},
      "mask": null,
      "blend": {"mode": "normal", "opacity": 1},
      "z_offset": 0
    },
    {
      "id": "outfit-render.01",
      "track_id": "model",
      "source": {"slot_id": "outfit.01", "representation": "render-ready"},
      "active_ranges": [{"start_frame": 0, "end_frame": 29}],
      "layout": {"box": {"x": 0, "y": 200, "width": 576, "height": 824}, "fit": "contain", "object_position": {"x": 0.5, "y": 0.5}},
      "transform": {"anchor": {"x": 288, "y": 612}, "keyframes": [{"frame": 0, "translate_x": 0, "translate_y": 0, "scale_x": 1, "scale_y": 1, "rotation_deg": 0, "opacity": 1, "easing": {"type": "hold"}}]},
      "mask": null,
      "blend": {"mode": "normal", "opacity": 1},
      "z_offset": 0
    },
    {
      "id": "outfit-render.02",
      "track_id": "model",
      "source": {"slot_id": "outfit.02", "representation": "render-ready"},
      "active_ranges": [{"start_frame": 29, "end_frame": 58}],
      "layout": {"box": {"x": 0, "y": 200, "width": 576, "height": 824}, "fit": "contain", "object_position": {"x": 0.5, "y": 0.5}},
      "transform": {"anchor": {"x": 288, "y": 612}, "keyframes": [{"frame": 29, "translate_x": 0, "translate_y": 0, "scale_x": 1, "scale_y": 1, "rotation_deg": 0, "opacity": 1, "easing": {"type": "hold"}}]},
      "mask": null,
      "blend": {"mode": "normal", "opacity": 1},
      "z_offset": 0
    },
    {
      "id": "outfit-render.03",
      "track_id": "model",
      "source": {"slot_id": "outfit.03", "representation": "render-ready"},
      "active_ranges": [{"start_frame": 58, "end_frame": 87}],
      "layout": {"box": {"x": 0, "y": 200, "width": 576, "height": 824}, "fit": "contain", "object_position": {"x": 0.5, "y": 0.5}},
      "transform": {"anchor": {"x": 288, "y": 612}, "keyframes": [{"frame": 58, "translate_x": 0, "translate_y": 0, "scale_x": 1, "scale_y": 1, "rotation_deg": 0, "opacity": 1, "easing": {"type": "hold"}}]},
      "mask": null,
      "blend": {"mode": "normal", "opacity": 1},
      "z_offset": 0
    },
    {
      "id": "outfit-render.04",
      "track_id": "model",
      "source": {"slot_id": "outfit.04", "representation": "render-ready"},
      "active_ranges": [{"start_frame": 87, "end_frame": 116}],
      "layout": {"box": {"x": 0, "y": 200, "width": 576, "height": 824}, "fit": "contain", "object_position": {"x": 0.5, "y": 0.5}},
      "transform": {"anchor": {"x": 288, "y": 612}, "keyframes": [{"frame": 87, "translate_x": 0, "translate_y": 0, "scale_x": 1, "scale_y": 1, "rotation_deg": 0, "opacity": 1, "easing": {"type": "hold"}}]},
      "mask": null,
      "blend": {"mode": "normal", "opacity": 1},
      "z_offset": 0
    },
    {
      "id": "outfit-render.05",
      "track_id": "model",
      "source": {"slot_id": "outfit.05", "representation": "render-ready"},
      "active_ranges": [{"start_frame": 116, "end_frame": 145}],
      "layout": {"box": {"x": 0, "y": 200, "width": 576, "height": 824}, "fit": "contain", "object_position": {"x": 0.5, "y": 0.5}},
      "transform": {"anchor": {"x": 288, "y": 612}, "keyframes": [{"frame": 116, "translate_x": 0, "translate_y": 0, "scale_x": 1, "scale_y": 1, "rotation_deg": 0, "opacity": 1, "easing": {"type": "hold"}}]},
      "mask": null,
      "blend": {"mode": "normal", "opacity": 1},
      "z_offset": 0
    },
    {
      "id": "outfit-render.06",
      "track_id": "model",
      "source": {"slot_id": "outfit.06", "representation": "render-ready"},
      "active_ranges": [{"start_frame": 145, "end_frame": 174}],
      "layout": {"box": {"x": 0, "y": 200, "width": 576, "height": 824}, "fit": "contain", "object_position": {"x": 0.5, "y": 0.5}},
      "transform": {"anchor": {"x": 288, "y": 612}, "keyframes": [{"frame": 145, "translate_x": 0, "translate_y": 0, "scale_x": 1, "scale_y": 1, "rotation_deg": 0, "opacity": 1, "easing": {"type": "hold"}}]},
      "mask": null,
      "blend": {"mode": "normal", "opacity": 1},
      "z_offset": 0
    },
    {